{
  "schemaVersion": 1,
  "operationId": "op-report-0002",
  "groupId": "piso-demo",
  "entityId": "req-001",
  "payload": {
    "occurrenceId": "occ-1792782000000",
    "deviceId": "dev-a1",
    "deviceEpoch": 1,
    "requestVersion": 1,
    "decisionRevision": 1,
    "mode": "ALARM",
    "mechanism": "ALARM_RUNTIME",
    "status": "PENDING_PERMISSION",
    "effectiveAtEpochMs": 1792782000000,
    "reportedAtEpochMs": 1792701000000,
    "reason": "Falta el permiso de alarmas exactas."
  }
}
