{
  "schemaVersion": 1,
  "operationId": "op-report-0003",
  "groupId": "piso-demo",
  "entityId": "req-001",
  "payload": {
    "occurrenceId": "occ-1792782000000",
    "deviceId": "dev-a1",
    "deviceEpoch": 2,
    "requestVersion": 2,
    "decisionRevision": 3,
    "mode": "NOTIFICATION",
    "mechanism": "EXPO_NOTIFICATIONS",
    "status": "CANCELLED",
    "effectiveAtEpochMs": 1792782000000,
    "reportedAtEpochMs": 1792790000000
  }
}
