{
  "schemaVersion": 1,
  "operationId": "op-semantic-blank",
  "groupId": "piso-demo",
  "payload": {
    "title": "   ",
    "recipientUids": ["ana"],
    "mode": "NOTIFICATION",
    "timeSpec": {
      "timeZone": "Europe/Madrid",
      "localDate": "2026-10-23",
      "localTime": "21:00",
      "effectiveAtEpochMs": 1792782000000
    }
  }
}
