{
  "schemaVersion": 1,
  "operationId": "op-respond-0002",
  "groupId": "piso-demo",
  "entityId": "req-001",
  "expectedRequestVersion": 2,
  "expectedDecisionRevision": 2,
  "payload": {
    "decision": "ACCEPTED",
    "consentScope": "SERIES",
    "chosenTimeSpec": {
      "timeZone": "Europe/Madrid",
      "localDate": "2026-10-23",
      "localTime": "20:30",
      "effectiveAtEpochMs": 1792780200000
    }
  }
}
